{
  "schemaVersion": "1.0.0",
  "territory": {
    "level": "COUNTRY",
    "country": "IT"
  },
  "language": "it",
  "updatedOn": "2026-10-18",
  "context": [
    "Le Regioni e le Province autonome pubblicano gli interventi di primo insediamento del Piano Strategico PAC; i bandi e le scadenze variano per territorio.",
    "ISMEA gestisce strumenti nazionali distinti: Banca delle Terre Agricole, Generazione Terra e Più Impresa.",
    "Una banca della terra istituita da una legge regionale non è operativa senza inventario, procedura o contatto attuale.",
    "Cercare anche ai livelli provincia, città metropolitana, comune, GAL e distretto rurale quando svolgono un servizio proprio."
  ],
  "portals": [
    {
      "name": "ISMEA",
      "url": "https://www.ismea.it/",
      "what": "Portale nazionale per gli strumenti fondiari e di imprenditoria giovanile da verificare singolarmente."
    },
    {
      "name": "MASAF",
      "url": "https://www.politicheagricole.it/",
      "what": "Portale del Ministero e accesso al Piano Strategico PAC nazionale."
    }
  ],
  "openData": [],
  "queries": [
    {
      "id": "ismea-land",
      "kinds": ["LAND_BANK", "FINANCIAL_SUPPORT"],
      "query": "site:ismea.it Banca delle Terre Agricole Generazione Terra giovani"
    },
    {
      "id": "ismea-succession",
      "kinds": ["FINANCIAL_SUPPORT", "SUCCESSION_SERVICE"],
      "query": "site:ismea.it Più Impresa giovani subentro azienda agricola"
    },
    {
      "id": "regional-entry",
      "kinds": ["FINANCIAL_SUPPORT"],
      "query": "{region} SRE01 insediamento giovani agricoltori bando"
    },
    {
      "id": "regional-land",
      "kinds": ["LAND_BANK"],
      "query": "{region} banca della terra inventario terreni agricoli assegnazione"
    },
    {
      "id": "prepublication-2026-09-25-1",
      "kinds": ["LAND_BANK", "SUCCESSION_SERVICE", "FINANCIAL_SUPPORT", "TRAINING", "ADVICE"],
      "query": "Italia insediamento agricoltori SRE01 formazione"
    }
  ],
  "leads": [
    {
      "id": "it-banca-terre-agricole",
      "name": "Banca delle Terre Agricole ISMEA",
      "url": "https://www.ismea.it/banca-delle-terre",
      "kind": "LAND_BANK",
      "status": "TO_CHECK",
      "reason": "Individuato lo strumento nazionale; serve una pagina stabile e verificabile con inventario e accesso attuali. 18/10/2026: Annex II, Inventory!115: tentativo sulla pagina specifica non riuscito; le aperture ISMEA restituiscono errore/502. Per Generazione Terra anche il precedente tentativo nel browser segnalava un problema della catena del certificato. Nessuna verifica aggirata. Restano da leggere pagina, documenti, requisiti e finestre 2026; gli estratti indicizzati non vengono pubblicati come prova. La pista resta TO_CHECK, non è un rifiuto dello strumento.",
      "foundBy": "ismea-land",
      "checkedOn": "2026-10-18"
    },
    {
      "id": "it-generazione-terra",
      "name": "Generazione Terra",
      "url": "https://www.ismea.it/Startup/GenerazioneTerra",
      "kind": "FINANCIAL_SUPPORT",
      "status": "TO_CHECK",
      "reason": "Individuato lo strumento; verificare la pagina dell'operatore e l'eventuale finestra attuale senza usare riassunti di terzi. 18/10/2026: Annex II, Inventory!114: tentativo sulla pagina specifica non riuscito; le aperture ISMEA restituiscono errore/502. Per Generazione Terra anche il precedente tentativo nel browser segnalava un problema della catena del certificato. Nessuna verifica aggirata. Restano da leggere pagina, documenti, requisiti e finestre 2026; gli estratti indicizzati non vengono pubblicati come prova. La pista resta TO_CHECK, non è un rifiuto dello strumento.",
      "foundBy": "ismea-land",
      "checkedOn": "2026-10-18"
    },
    {
      "id": "it-piu-impresa",
      "name": "Più Impresa",
      "url": "https://www.ismea.it/flex/cm/pages/ServeBLOB.php/L/IT/IDPagina/13592",
      "kind": "FINANCIAL_SUPPORT",
      "status": "TO_CHECK",
      "reason": "Individuato lo strumento nazionale per giovani e donne; accesso e stato corrente non ancora verificati su una pagina leggibile. 18/10/2026: Annex II, Inventory!116: tentativo sulla pagina specifica non riuscito; le aperture ISMEA restituiscono errore/502. Per Generazione Terra anche il precedente tentativo nel browser segnalava un problema della catena del certificato. Nessuna verifica aggirata. Restano da leggere pagina, documenti, requisiti e finestre 2026; gli estratti indicizzati non vengono pubblicati come prova. La pista resta TO_CHECK, non è un rifiuto dello strumento.",
      "foundBy": "ismea-succession",
      "checkedOn": "2026-10-18"
    },
    {
      "id": "it-legge-36-2024",
      "name": "Legge 15 marzo 2024, n. 36",
      "kind": "POLICY",
      "status": "TO_CHECK",
      "reason": "Scheda della Gazzetta letta: conferma la legge per l’imprenditoria giovanile agricola e l’entrata in vigore originaria. Non basta a provare accesso attuale a ciascuna misura. Leggere testo vigente, atti attuativi e procedure prima di ammettere agevolazioni fiscali, fondo o servizi dell’osservatorio come operativi.",
      "foundBy": "EU CAP Network Annex II (2026-02-23), Inventory!117",
      "checkedOn": "2026-10-18",
      "url": "https://www.gazzettaufficiale.it/eli/id/2024/03/26/24G00054/SG"
    }
  ],
  "expectedInstruments": [
    {
      "id": "it-sre01-bando-regionale",
      "name": "Bando regionale SRE01 per il primo insediamento",
      "kinds": ["FINANCIAL_SUPPORT"],
      "lookFor": "Bando dell'intervento SRE01, spesso nel pacchetto giovani con SRD01, sul portale agricoltura o sviluppo rurale della Regione o Provincia autonoma: premio, risorse, beneficiari e scadenza del bando corrente o più recente."
    },
    {
      "id": "it-banca-terra-regionale",
      "name": "Banca della terra regionale",
      "kinds": ["LAND_BANK"],
      "lookFor": "Banca della terra istituita da legge regionale e gestita da Regione, agenzia o ente regionale, con lotti o bandi di concessione. È distinta dalla Banca delle Terre Agricole di ISMEA, che è nazionale."
    },
    {
      "id": "it-formazione-insediamento",
      "name": "Formazione per il primo insediamento",
      "kinds": ["TRAINING"],
      "lookFor": "Corsi riconosciuti per la capacità professionale richiesta dal primo insediamento, organizzati da enti di formazione accreditati o dalla Regione."
    },
    {
      "id": "it-organizzazioni-servizi",
      "name": "Servizi delle organizzazioni agricole per insediamento e ricambio",
      "kinds": ["ADVICE", "SUCCESSION_SERVICE"],
      "lookFor": "Servizi regionali concreti di organizzazioni professionali agricole, consorzi o associazioni per insediamento, subentro o accesso alla terra, con pagina e contatto."
    }
  ],
  "log": [
    {
      "date": "2026-09-14",
      "by": "CHATGPT (Codex)",
      "summary": "Prima ricerca nazionale e seconda passata sui nomi ISMEA; tre strumenti mantenuti come piste perché le pagine specifiche non erano verificabili in modo affidabile."
    },
    {
      "date": "2026-09-25",
      "by": "CHATGPT (Codex)",
      "summary": "Ricognizione preliminare prima della pubblicazione: eseguite le query prepublication-2026-09-25. Solo scoperta, non revisione completa né prova di assenza. Restano da verificare candidati, tutte le famiglie, livelli locali e dettagli pratici. Questa ricognizione non modifica stati o date dell’edizione."
    },
    {
      "date": "2026-10-18",
      "by": "CHATGPT (Codex)",
      "summary": "Confronto mirato con Annex II: aggiornati gli URL e i blocchi ISMEA, aggiunta la pista della legge 36/2024. Nessuna nuova verifica territoriale completa; schede e date dell’edizione restano invariate."
    }
  ]
}
